[
  {
    "commitment_id": "C-NH-01",
    "source_file": "01-neon-hollow-deliverable-alpha.pdf",
    "production": "NEON HOLLOW",
    "deliverable": "Alpha",
    "covers_shot_ids": [
      "NH-001",
      "NH-002",
      "NH-003",
      "NH-004",
      "NH-005",
      "NH-006",
      "NH-007",
      "NH-008",
      "NH-009",
      "NH-010",
      "NH-011",
      "NH-012",
      "NH-013",
      "NH-014",
      "NH-015",
      "NH-016",
      "NH-017",
      "NH-018",
      "NH-019",
      "NH-020",
      "NH-021",
      "NH-022",
      "NH-023",
      "NH-024",
      "NH-025",
      "NH-026",
      "NH-027",
      "NH-028",
      "NH-029",
      "NH-030",
      "NH-031",
      "NH-032",
      "NH-033",
      "NH-034",
      "NH-035",
      "NH-036",
      "NH-037",
      "NH-038",
      "NH-039",
      "NH-040"
    ],
    "due_at": "2026-09-06T17:00:00Z",
    "owner": "M. Okafor",
    "notes": "Final VFX turnover for the opening city flyover; night plates graded and grain-matched.",
    "confidence": 1,
    "page_refs": [
      1
    ],
    "synthetic": true
  },
  {
    "commitment_id": "C-NH-02",
    "source_file": "02-neon-hollow-deliverable-beta.pdf",
    "production": "NEON HOLLOW",
    "deliverable": "Beta",
    "covers_shot_ids": [
      "NH-041",
      "NH-042",
      "NH-043",
      "NH-044",
      "NH-045",
      "NH-046",
      "NH-047",
      "NH-048",
      "NH-049",
      "NH-050",
      "NH-051",
      "NH-052",
      "NH-053",
      "NH-054",
      "NH-055",
      "NH-056",
      "NH-057",
      "NH-058",
      "NH-059",
      "NH-060",
      "NH-061",
      "NH-062",
      "NH-063",
      "NH-064",
      "NH-065",
      "NH-066",
      "NH-067",
      "NH-068",
      "NH-069",
      "NH-070",
      "NH-071",
      "NH-072",
      "NH-073",
      "NH-074",
      "NH-075",
      "NH-076",
      "NH-077",
      "NH-078",
      "NH-079",
      "NH-080"
    ],
    "due_at": "2026-09-07T17:00:00Z",
    "owner": "J. Reyes",
    "notes": "Creature cleanup and wire removal across the canyon chase; roto locked per supervisor review.",
    "confidence": 1,
    "page_refs": [
      1
    ],
    "synthetic": true
  },
  {
    "commitment_id": "C-NH-03",
    "source_file": "03-neon-hollow-deliverable-gamma.pdf",
    "production": "NEON HOLLOW",
    "deliverable": "Gamma",
    "covers_shot_ids": [
      "NH-081",
      "NH-082",
      "NH-083",
      "NH-084",
      "NH-085",
      "NH-086",
      "NH-087",
      "NH-088",
      "NH-089",
      "NH-090",
      "NH-091",
      "NH-092",
      "NH-093",
      "NH-094",
      "NH-095",
      "NH-096",
      "NH-097",
      "NH-098",
      "NH-099",
      "NH-100",
      "NH-101",
      "NH-102",
      "NH-103",
      "NH-104",
      "NH-105",
      "NH-106",
      "NH-107",
      "NH-108",
      "NH-109",
      "NH-110",
      "NH-111",
      "NH-112",
      "NH-113",
      "NH-114",
      "NH-115",
      "NH-116",
      "NH-117",
      "NH-118",
      "NH-119",
      "NH-120"
    ],
    "due_at": "2026-09-08T17:00:00Z",
    "owner": "A. Lindqvist",
    "notes": "Neon signage replacements and hologram inserts for the market sequence; font pack v3 approved.",
    "confidence": 1,
    "page_refs": [
      1
    ],
    "synthetic": true
  },
  {
    "commitment_id": "C-NH-04",
    "source_file": "04-neon-hollow-deliverable-delta.pdf",
    "production": "NEON HOLLOW",
    "deliverable": "Delta",
    "covers_shot_ids": [
      "NH-121",
      "NH-122",
      "NH-123",
      "NH-124",
      "NH-125",
      "NH-126",
      "NH-127",
      "NH-128",
      "NH-129",
      "NH-130",
      "NH-131",
      "NH-132",
      "NH-133",
      "NH-134",
      "NH-135",
      "NH-136",
      "NH-137",
      "NH-138",
      "NH-139",
      "NH-140",
      "NH-141",
      "NH-142",
      "NH-143",
      "NH-144",
      "NH-145",
      "NH-146",
      "NH-147",
      "NH-148",
      "NH-149",
      "NH-150",
      "NH-151",
      "NH-152",
      "NH-153",
      "NH-154",
      "NH-155",
      "NH-156",
      "NH-157",
      "NH-158",
      "NH-159",
      "NH-160"
    ],
    "due_at": "2026-09-09T17:00:00Z",
    "owner": "R. Patel",
    "notes": "Storm extension and sky replacements for the rooftop duel; sim caches versioned and archived.",
    "confidence": 1,
    "page_refs": [
      1
    ],
    "synthetic": true
  },
  {
    "commitment_id": "C-NH-05",
    "source_file": "05-neon-hollow-deliverable-epsilon.pdf",
    "production": "NEON HOLLOW",
    "deliverable": "Epsilon",
    "covers_shot_ids": [
      "NH-161",
      "NH-162",
      "NH-163",
      "NH-164",
      "NH-165",
      "NH-166",
      "NH-167",
      "NH-168",
      "NH-169",
      "NH-170",
      "NH-171",
      "NH-172",
      "NH-173",
      "NH-174",
      "NH-175",
      "NH-176",
      "NH-177",
      "NH-178",
      "NH-179",
      "NH-180",
      "NH-181",
      "NH-182",
      "NH-183",
      "NH-184",
      "NH-185",
      "NH-186",
      "NH-187",
      "NH-188",
      "NH-189",
      "NH-190",
      "NH-191",
      "NH-192",
      "NH-193",
      "NH-194",
      "NH-195",
      "NH-196",
      "NH-197",
      "NH-198",
      "NH-199",
      "NH-200"
    ],
    "due_at": "2026-09-10T17:00:00Z",
    "owner": "S. Chen",
    "notes": "Crowd tiling and digi-double integration for the plaza evacuation; matchmove re-exported.",
    "confidence": 1,
    "page_refs": [
      1
    ],
    "synthetic": true
  },
  {
    "commitment_id": "C-NH-06",
    "source_file": "06-neon-hollow-deliverable-zeta.pdf",
    "production": "NEON HOLLOW",
    "deliverable": "Zeta",
    "covers_shot_ids": [
      "NH-201",
      "NH-202",
      "NH-203",
      "NH-204",
      "NH-205",
      "NH-206",
      "NH-207",
      "NH-208",
      "NH-209",
      "NH-210",
      "NH-211",
      "NH-212",
      "NH-213",
      "NH-214",
      "NH-215",
      "NH-216",
      "NH-217",
      "NH-218",
      "NH-219",
      "NH-220",
      "NH-221",
      "NH-222",
      "NH-223",
      "NH-224",
      "NH-225",
      "NH-226",
      "NH-227",
      "NH-228",
      "NH-229",
      "NH-230",
      "NH-231",
      "NH-232",
      "NH-233",
      "NH-234",
      "NH-235",
      "NH-236",
      "NH-237",
      "NH-238",
      "NH-239",
      "NH-240"
    ],
    "due_at": "2026-09-11T17:00:00Z",
    "owner": "D. Marsh",
    "notes": "Title-sequence particle pass and end-card compositing; color pipeline ACEScg throughout.",
    "confidence": 1,
    "page_refs": [
      1
    ],
    "synthetic": true
  }
]
